{
  "$schema": "./node_modules/@shipsite.dev/core/shipsite.schema.json",
  "name": "Test Site",
  "url": "https://testsite.com",
  "logo": "/images/logo.svg",
  "favicon": "/favicon.png",
  "ogImage": "/images/og-image.jpg",
  "colors": {
    "primary": "#5d5bd4",
    "accent": "#067647",
    "background": "#ffffff",
    "text": "#1f2a37"
  },
  "fonts": {
    "heading": "Inter",
    "body": "Inter"
  },
  "i18n": {
    "defaultLocale": "en",
    "locales": [
      "en"
    ],
    "localePrefix": "as-needed"
  },
  "navigation": {
    "items": [
      {
        "label": "Features",
        "href": "/features"
      },
      {
        "label": "Pricing",
        "href": "/pricing"
      },
      {
        "label": "Blog",
        "href": "/blog"
      }
    ],
    "cta": {
      "label": "Get Started",
      "href": "https://app.testsite.com/signup"
    }
  },
  "footer": {
    "columns": [
      {
        "title": "Product",
        "links": [
          {
            "label": "Features",
            "href": "/features"
          },
          {
            "label": "Pricing",
            "href": "/pricing"
          }
        ]
      },
      {
        "title": "Legal",
        "links": [
          {
            "label": "Privacy Policy",
            "href": "/privacy"
          },
          {
            "label": "Terms of Service",
            "href": "/terms"
          }
        ]
      }
    ],
    "copyright": "Â© 2026 Test Site"
  },
  "pages": [
    {
      "slug": "",
      "type": "landing",
      "content": "landing",
      "locales": [
        "en"
      ]
    },
    {
      "slug": "pricing",
      "type": "page",
      "content": "pricing",
      "locales": [
        "en"
      ]
    },
    {
      "slug": "blog",
      "type": "blog-index",
      "content": "blog",
      "locales": [
        "en"
      ]
    },
    {
      "slug": "blog/getting-started",
      "type": "blog-article",
      "content": "blog/getting-started",
      "locales": [
        "en"
      ]
    },
    {
      "slug": "privacy",
      "type": "legal",
      "content": "privacy",
      "locales": [
        "en"
      ]
    },
    {
      "slug": "terms",
      "type": "legal",
      "content": "terms",
      "locales": [
        "en"
      ]
    },
    {
      "slug": "features",
      "type": "page",
      "content": "features",
      "locales": [
        "en"
      ]
    },
    {
      "slug": "blog/my-first-post",
      "type": "blog-article",
      "content": "blog/my-first-post",
      "locales": [
        "en"
      ]
    }
  ],
  "blog": {
    "authors": {
      "default": {
        "name": "Team",
        "role": "Author",
        "image": "/images/team.avif"
      }
    }
  }
}
