{
  "$schema": "https://schema.shipsite.dev/v1.json",
  "name": "ShipSite",
  "url": "https://shipsite.dev",
  "logo": "/images/logo.svg",
  "favicon": "/favicon.png",
  "colors": {
    "primary": "#5d5bd4",
    "accent": "#067647"
  },
  "fonts": {
    "heading": "Inter",
    "body": "Inter"
  },
  "navigation": {
    "items": [
      { "label": "Features", "href": "#features" },
      { "label": "Blog", "href": "/blog" }
    ],
    "cta": { "label": "GitHub", "href": "https://github.com/shipsite/shipsite" }
  },
  "footer": {
    "columns": [
      {
        "title": "Product",
        "links": [
          { "label": "Features", "href": "#features" },
          { "label": "Blog", "href": "/blog" },
          { "label": "GitHub", "href": "https://github.com/shipsite/shipsite" }
        ]
      },
      {
        "title": "Resources",
        "links": [
          { "label": "Quick Start", "href": "https://github.com/shipsite/shipsite#quick-start" },
          { "label": "Components", "href": "https://github.com/shipsite/shipsite#components" },
          { "label": "npm", "href": "https://www.npmjs.com/package/@shipsite/cli" }
        ]
      }
    ],
    "social": [
      { "platform": "github", "href": "https://github.com/shipsite/shipsite" }
    ],
    "copyright": "© 2026 ShipSite — MIT License"
  },
  "pages": [
    { "slug": "", "type": "landing", "content": "landing", "locales": ["en"] },
    { "slug": "blog", "type": "blog-index", "content": "blog", "locales": ["en"] },
    { "slug": "blog/why-ai-native-websites", "type": "blog-article", "content": "blog/why-ai-native-websites", "locales": ["en"] },
    { "slug": "blog/programmatic-seo-with-shipsite", "type": "blog-article", "content": "blog/programmatic-seo-with-shipsite", "locales": ["en"] }
  ],
  "blog": {
    "authors": {
      "shipsite-team": {
        "name": "ShipSite Team",
        "role": "Engineering",
        "image": "/images/team.avif"
      }
    }
  }
}
